{
  "$schema": "http://json-schema.org/draft-07/schema#",
  "$id": "https://kokitchen.berlin/screen-ad-generator/content.schema.json",
  "title": "Screen ad content model",
  "description": "The only source of truth for on-screen items, prices, allergens and legal lines. The generator NEVER invents, derives or rounds any of these values.",
  "type": "object",
  "additionalProperties": false,
  "required": ["language", "items", "legal"],
  "properties": {
    "language": {
      "description": "Drives number/date formatting and the default copy strings.",
      "enum": ["de", "en"]
    },
    "title": {
      "type": "string",
      "minLength": 2,
      "maxLength": 32,
      "description": "Board headline, e.g. 'Mittag'."
    },
    "subtitle": {
      "type": "string",
      "maxLength": 64,
      "description": "Board sub-headline, e.g. 'Wochenkarte KW 40'."
    },
    "badge": {
      "type": "string",
      "maxLength": 32,
      "description": "Optional corner badge text, e.g. 'Heute · Mittwoch'."
    },
    "hours": {
      "type": "string",
      "maxLength": 48,
      "description": "Opening-hours line as displayed. Must be confirmed by the operator; the generator does not derive it."
    },
    "items": {
      "type": "array",
      "minItems": 1,
      "maxItems": 5,
      "description": "1-5 items. The landscape menu-board template fits 4 items at full type size; a 5th is allowed but the template warns.",
      "items": { "$ref": "#/definitions/item" }
    },
    "promo": { "$ref": "#/definitions/promo" },
    "legal": { "$ref": "#/definitions/legal" }
  },
  "definitions": {
    "item": {
      "type": "object",
      "additionalProperties": false,
      "required": ["id", "name", "price", "allergens", "image"],
      "properties": {
        "id": {
          "type": "string",
          "pattern": "^[a-z0-9][a-z0-9-]{1,31}$",
          "description": "Stable slug; names the output folder under work/images/<id>/."
        },
        "name": {
          "type": "string",
          "minLength": 2,
          "maxLength": 42,
          "description": "Dish name exactly as it must appear on screen."
        },
        "description": {
          "type": "string",
          "maxLength": 96,
          "description": "Ingredient line. No health claims: 'superfood', 'detox', 'heilt', 'entgiftet' are rejected by the validator."
        },
        "price": {
          "type": "number",
          "exclusiveMinimum": 0,
          "maximum": 999,
          "description": "Final consumer price in EUR including VAT and service charges (PAngV). Never a placeholder, never a range."
        },
        "currency": {
          "enum": ["EUR"],
          "default": "EUR",
          "description": "Only EUR is implemented in v1."
        },
        "promo": {
          "type": "string",
          "maxLength": 24,
          "description": "Short ribbon text, e.g. 'Neu'. Do not use 'war/now' price claims unless the old price genuinely ran."
        },
        "allergens": {
          "type": "array",
          "uniqueItems": true,
          "items": { "enum": ["A", "B", "C", "D", "E", "F", "G", "H", "I", "J", "K", "L", "M", "N"] },
          "description": "EU-14 codes (LMIV Annex II). A=Gluten B=Krebstiere C=Ei D=Fisch E=Erdnuss F=Soja G=Milch H=Schalenfrüchte I=Sellerie J=Senf K=Sesam L=Schwefeldioxid M=Lupine N=Weichtiere. Empty array = the operator declared no allergens; it must be explicit, never omitted."
        },
        "diet": {
          "type": "array",
          "uniqueItems": true,
          "items": { "enum": ["vegan", "vegetarisch", "halal", "glutenfrei", "laktosefrei"] },
          "description": "Only declare what the operator confirmed. The generator never infers a diet label from the ingredient text."
        },
        "image": {
          "type": "string",
          "minLength": 3,
          "description": "Photo filename, resolved relative to --photos."
        },
        "focalPoint": {
          "type": "array",
          "items": { "type": "number", "minimum": 0, "maximum": 1 },
          "minItems": 2,
          "maxItems": 2,
          "description": "[x, y] in 0..1 source-image coordinates. Overrides the alpha-centroid fallback."
        }
      }
    },
    "promo": {
      "type": "object",
      "additionalProperties": false,
      "required": ["kind", "headline", "tiers"],
      "description": "Optional full-screen promo loop appended after the menu board in the same video.",
      "properties": {
        "kind": { "enum": ["membership", "product", "announcement"] },
        "headline": { "type": "string", "maxLength": 40 },
        "kicker": { "type": "string", "maxLength": 24 },
        "cta": { "type": "string", "maxLength": 40 },
        "terms": {
          "type": "string",
          "maxLength": 120,
          "description": "Contract terms (minimum term, notice period, validity). Only set this when the operator confirmed it; leaving it out is safe, inventing it is not."
        },
        "image": { "type": "string", "description": "Photo filename for the promo background, relative to --photos." },
        "tiers": {
          "type": "array",
          "minItems": 1,
          "maxItems": 3,
          "items": {
            "type": "object",
            "additionalProperties": false,
            "required": ["label", "price"],
            "properties": {
              "label": { "type": "string", "maxLength": 32 },
              "price": { "type": "number", "exclusiveMinimum": 0, "maximum": 999 },
              "unit": { "type": "string", "maxLength": 24, "description": "e.g. 'im Monat'." },
              "highlight": { "type": "boolean", "default": false }
            }
          }
        }
      }
    },
    "legal": {
      "type": "object",
      "additionalProperties": false,
      "required": ["vatNote"],
      "properties": {
        "vatNote": {
          "type": "string",
          "maxLength": 64,
          "description": "e.g. 'Preise inkl. MwSt.' Required: PAngV requires the total price to be evident."
        },
        "allergenNote": {
          "type": "string",
          "maxLength": 120,
          "description": "e.g. 'vollständige Liste auf der gedruckten Karte'."
        },
        "address": { "type": "string", "maxLength": 64 },
        "website": { "type": "string", "maxLength": 48 }
      }
    }
  }
}
